{
  "schema_version": 3,
  "project": "assurance-scan",
  "catalogue_version": "2026-08-07T00:00:00Z",
  "frs": [
    {
      "id": "FR-CATALOGUE-LOAD",
      "title": "Load and validate an FR catalogue from JSON",
      "description": "Given a path to a v3 catalogue JSON file, the system reads it, validates against the schema, snapshots it immutably into the DB, and makes its FRs available for state computation.",
      "category": "core",
      "implemented_by": [
        {
          "kind": "file",
          "ref": "server/catalogue/loader.py"
        },
        {
          "kind": "file",
          "ref": "server/db/repositories/catalogue_snapshots.py"
        }
      ],
      "tests": [
        {
          "id": "loader-validation",
          "type": "unit-test",
          "name_pattern": "tests.phase1.test_catalogue::*",
          "description": "Loader accepts valid v3 catalogues and rejects malformed ones.",
          "display": {
            "output_example": {
              "id": 42,
              "project_path": "/path/to/project",
              "catalogue_version": "2026-08-07T00:00:00Z",
              "content_hash": "sha256:abc123...",
              "created_at": "2026-08-08T12:00:00Z"
            },
            "output": {
              "expected": "snapshot row inserted, FRs queryable, malformed input rejected"
            },
            "side_effect": [
              "db-write"
            ],
            "input_example": {
              "schema_version": 3,
              "project": "example-project",
              "frs": [
                {
                  "id": "FR-1",
                  "title": "Do thing",
                  "description": "...",
                  "category": "core",
                  "implemented_by": [
                    {
                      "kind": "file",
                      "ref": "src/thing.py"
                    }
                  ],
                  "tests": [
                    {
                      "id": "t1",
                      "type": "unit-test",
                      "name_pattern": "tests/test_thing::*"
                    }
                  ],
                  "satisfies": [],
                  "depends_on": []
                }
              ]
            },
            "input": {
              "catalogue_path": "./fr-catalog.json",
              "schema": "v3"
            }
          }
        }
      ]
    },
    {
      "id": "FR-STATE-COMPUTE",
      "title": "Compute FR state from test results",
      "description": "After tests run, the system computes a state per FR (untested | pending | passed | failed | waived | blocked) using the precedence ladder.",
      "category": "core",
      "implemented_by": [
        {
          "kind": "file",
          "ref": "server/state/resolver.py"
        },
        {
          "kind": "file",
          "ref": "server/evidence/state_compute.py"
        }
      ],
      "tests": [
        {
          "id": "state-machine",
          "type": "unit-test",
          "name_pattern": "tests.phase1.test_state::*",
          "description": "8-state precedence ladder exercised across all transitions.",
          "display": {
            "output_example": {
              "state": "passed",
              "evaluations": {
                "t1": {
                  "result": "pass"
                }
              }
            },
            "output": {
              "expected": "FR state per 8-step precedence ladder (untested|pending|passed|failed|waived|blocked)"
            },
            "side_effect": [
              "none"
            ],
            "input_example": {
              "fr": {
                "id": "FR-1",
                "tests": [
                  {
                    "id": "t1",
                    "type": "scanner-clean",
                    "scanner": "x"
                  }
                ],
                "depends_on": []
              },
              "evaluations": {
                "t1": {
                  "result": "pass"
                }
              },
              "waivers_present": false,
              "dep_states": {}
            },
            "input": {
              "test_evaluations": "per-test pass/fail/pending dict",
              "waivers_present": "bool",
              "dep_states": "transitive dependency states"
            }
          }
        }
      ]
    },
    {
      "id": "FR-EVIDENCE-MATCH",
      "title": "Match evidence records to test specs",
      "description": "The system matches collected evidence (scanner findings, test case results) against the tests declared on each FR, producing pass/fail per test.",
      "category": "core",
      "implemented_by": [
        {
          "kind": "file",
          "ref": "server/state/matcher.py"
        }
      ],
      "tests": [
        {
          "id": "matcher-suite",
          "type": "unit-test",
          "name_pattern": "tests.phase1.test_matcher::*",
          "description": "Matcher handles each spec type correctly.",
          "display": {
            "output_example": {
              "result": "fail",
              "reason": "1 HIGH finding from semgrep"
            },
            "output": {
              "expected": "per-test pass/fail matching the spec semantics"
            },
            "side_effect": [
              "none"
            ],
            "input_example": {
              "test_spec": {
                "id": "scanner-clean-x",
                "type": "scanner-clean",
                "scanner": "semgrep"
              },
              "evidence": {
                "findings": [
                  {
                    "scanner_kind": "semgrep",
                    "severity": "HIGH",
                    "rule_id": "rule-1"
                  }
                ]
              }
            },
            "input": {
              "test_specs": "all_of / any_of / none_of / scanner-clean variants",
              "evidence": "scanner findings + test case results"
            }
          }
        }
      ]
    },
    {
      "id": "FR-SCAN-EXEC",
      "title": "Execute configured scanners against a codebase",
      "description": "When a scan is requested, the system spawns each configured scanner as a sibling container via the host docker socket, captures stdout/stderr, parses findings, and stores raw artifacts + normalized findings in SQLite.",
      "category": "scan",
      "implemented_by": [
        {
          "kind": "file",
          "ref": "server/worker/orchestrator.py"
        },
        {
          "kind": "file",
          "ref": "server/worker/runner.py"
        },
        {
          "kind": "file",
          "ref": "server/worker/scanners.py"
        }
      ],
      "tests": [
        {
          "id": "parsers",
          "type": "unit-test",
          "name_pattern": "tests.phase1.test_parsers::*",
          "description": "Per-scanner parsers correctly normalize SARIF/JSON output.",
          "display": {
            "output_example": [
              {
                "scanner_kind": "semgrep",
                "severity": "HIGH",
                "rule_id": "python.lang.security.insecure-hash-algorithm-sha1",
                "file_path": "src/main.py",
                "line_start": 10,
                "message": "Detected SHA1"
              }
            ],
            "output": {
              "expected": "normalized findings list with severity, file_path, rule_id, message"
            },
            "side_effect": [
              "none"
            ],
            "input_example": {
              "scanner": "semgrep",
              "format": "sarif",
              "raw": {
                "version": "2.1.0",
                "runs": [
                  {
                    "tool": {
                      "driver": {
                        "name": "semgrep"
                      }
                    },
                    "results": [
                      {
                        "ruleId": "python.lang.security.insecure-hash-algorithm-sha1",
                        "level": "error",
                        "message": {
                          "text": "Detected SHA1"
                        },
                        "locations": [
                          {
                            "physicalLocation": {
                              "artifactLocation": {
                                "uri": "src/main.py"
                              },
                              "region": {
                                "startLine": 10
                              }
                            }
                          }
                        ]
                      }
                    ]
                  }
                ]
              }
            },
            "input": {
              "scanner_outputs": "SARIF (semgrep), JSON (gitleaks, trivy, grype, syft, osv-scanner)"
            }
          }
        }
      ]
    },
    {
      "id": "FR-FINDINGS-PERSIST",
      "title": "Persist scanner findings and raw artifacts in SQLite",
      "description": "All scanner output (normalized findings, raw gzip-compressed artifacts) is stored durably in SQLite. Project repo is never written to.",
      "category": "persistence",
      "implemented_by": [
        {
          "kind": "file",
          "ref": "server/db/repositories/findings.py"
        },
        {
          "kind": "file",
          "ref": "server/db/repositories/scanner_artifacts.py"
        }
      ],
      "tests": [
        {
          "id": "findings-persistence",
          "type": "unit-test",
          "name_pattern": "tests.phase1.test_findings_persist::*",
          "description": "Findings bulk-insert + queryable by run + severity filter; raw scanner artifacts gzip-compressed with content hash and decompress roundtrip.",
          "display": {
            "output_example": {
              "inserted": 1,
              "queryable_by": [
                "run_id",